id,ingredients
516,"Light rum, Sweet Vermouth, Lemon, Powdered sugar, Egg white"
517,"Dark rum, Cherry brandy"
518,"Gin, Sweet Vermouth, Brandy"
519,"Vodka, Lemon juice, Grape juice, Powdered sugar, Orange"
520,"Vodka, Tonic water"
521,"Vodka, Half-and-half, Limeade, Ice, Nutmeg"
522,"Vodka, Dry Vermouth, Olive"
523,"Vodka, Schweppes Russchian"
524,"Triple sec, Gin, Pineapple juice"
525,"Blended whiskey, Lemon, Powdered sugar, Cherry, Lemon"
526,"Scotch, Wine"
527,"Gin, Triple Sec, Lemon Juice"
528,"Vodka, Coffee liqueur, Light cream"
529,"Ice, Tequila, Cream of coconut, Lime juice"
530,"Red wine, Lemon-lime soda, Ice"
531,"Red wine, Lemon, Orange juice, Orange, Pineapple juice"
532,"White Rum, Galliano, Triple Sec, Lime Juice"
533,"Yoghurt, Fruit, Ice"
534,"Sambuca, Root beer, Ice"
535,"Jägermeister, Root beer"
536,"Vermouth, Apple juice"
537,"Zima, Chambord raspberry liqueur"
538,"Midori melon liqueur, Zima"
539,"Peachtree schnapps, Surge"
540,"Chambord raspberry liqueur, Vodka, Soda water"
541,"Amaretto, Rum, Kool-Aid"
542,"Cointreau, Lemon juice, Ice, Lemon"
543,"Beer, Root beer, Lemonade, Coca-Cola, 7-Up, Creme de Cassis, Lemon"
544,"Vodka, Ouzo"
545,"Sambuca, Bailey's irish cream, White Creme de Menthe"
