id,ingredients
0,"Creme de Cacao, Vodka"
1,"Absolut Kurant, Grand Marnier, Chambord raspberry liqueur, Midori melon liqueur, Malibu rum, Amaretto, Cranberry juice, Pineapple juice"
2,"Lager, Tequila"
3,"Malibu rum, Light rum, 151 proof rum, Dark Creme de Cacao, Cointreau, Milk, Coconut liqueur, Vanilla ice-cream"
4,"Dark rum, Light rum, Vodka, Orange juice"
5,"Goldschlager, Jägermeister, Rumple Minze, 151 proof rum"
6,"151 proof rum, Wild Turkey"
7,"Jack Daniels, Johnnie Walker, Jim Beam"
8,"Gin, Light rum, Tequila, Triple sec, Vodka, Coca-Cola, Sweet and sour, Bitters, Lemon"
9,"Peach Vodka, Coca-Cola"
10,"Vanilla vodka, Grand Marnier, Orange juice"
11,"Blue Curacao, Blueberry schnapps, Vodka, Sour mix, 7-Up"
12,"Gin, 7-Up, Lemon juice"
13,"Kahlua, Bailey's irish cream, Frangelico"
14,"Absolut Citron, Orange Curacao, Strawberry liqueur, Orange juice"
15,"Coconut rum, Amaretto, Orange juice, Grenadine"
16,"Light rum, Ginger beer, Lemon peel"
17,"Vodka, Peach schnapps, Orange juice, Cranberry juice"
18,"Light rum, Añejo rum, Orange juice, Lemon juice, Ginger ale, Lemon peel"
19,"Amaretto, Southern Comfort, Ice, Sour mix"
20,"Cranberry juice, Soda water, Midori melon liqueur, Creme de Banane"
21,"Amaretto, Lemon, Ice, Maraschino cherry"
22,"Vodka, Kirschwasser, Strawberry liqueur, Strawberries, Schweppes Russchian"
23,"Applejack, Grapefruit juice"
24,"White Creme de Menthe, Southern Comfort, Vodka, Hot chocolate"
25,"Gin, Grand Marnier, Lemon Juice, Grenadine"
26,"Amaretto, Bailey's irish cream, Cognac"
27,"151 proof rum, Wild Turkey"
28,"Absolut Vodka, Gin, Tonic water"
29,"Gin, Orange bitters, Orange, Cherry"
30,"Gin, Sweet Vermouth, Orange Juice, Angostura Bitters"
31,"Dark rum, Peach nectar, Orange juice"
32,"Vodka, Sugar, Anise, Licorice root, Wormwood"
33,"Absolut Citron, Pisang Ambon, Ice, Bitter lemon"
34,"Absolut Kurant, Midori melon liqueur, Cranberry juice, Sprite"
35,"Absolut Vodka, Peach schnapps, Coconut liqueur, Cranberry juice, Pineapple juice"
36,"Absolut Citron, Sweet and sour, Sprite, Soda water, Lemon"
37,"Absolut Citron, Lime juice, Ice, Tonic water"
38,"Absolut Vodka, Cranberry juice, Ginger ale, Ice"
39,"Vodka, Cranberry Juice, Champagne"
40,"Absolut Citron, Orange juice, Triple sec, Ginger ale"
41,"Light rum, Triple sec, Lime juice, Sugar, Egg white, Mint"
42,"Gin, Grenadine, Heavy cream, Milk, Egg White"
43,"Dark rum, Lemon juice, Grenadine"
44,"Gin, Cognac, Creme de Cassis, Fresh Lemon Juice"
45,"Rum, Vodka, Tequila, Triple sec, Fruit, Ice, Salt, Fruit juice"
46,"Vodka, Lemonade, Water, Sugar"
47,"Sweet Vermouth, Dry Vermouth, Soda Water"
48,"Gin, Vermouth"
49,"Vodka, Grenadine, Orange juice"
50,"Rum, Dry Vermouth, Cognac, Gin, Fresh Lime Juice, Sugar Syrup, Water"
51,"Sweet Vermouth, Sherry, Orange bitters"
52,"Strawberry schnapps, Orange juice, Cranberry juice, Club soda"
53,"Scotch, Sweet Vermouth, Dry Vermouth, Orange bitters"
54,"Apricot brandy, Triple sec, Lime, Lime"
55,"Peppermint schnapps, Kahlua, Bailey's irish cream"
56,"Triple sec, Apricot brandy, Lemon juice"
57,"Vodka, Creme de Banane, Orange juice"
58,"Grenadine, Orange juice, Pineapple juice"
59,"Kahlua, Bailey's irish cream, Frangelico, Coffee, Cream"
60,"Southern Comfort, Amaretto, Sloe gin, Lemon juice"
61,"Orange bitters, Gin, Yellow Chartreuse, Lemon peel"
62,"Gin, Creme de Cacao, Light cream, Nutmeg"
63,"Lemon vodka, Triple sec, Pineapple juice"
64,"Blended whiskey, Dry Vermouth, Pineapple juice"
65,"Grenadine, Orange juice, Pineapple juice, Cream"
66,"Amaretto, Grand Marnier, Southern Comfort"
67,"Dry Vermouth, Bourbon, Blackberry brandy, Lemon juice, Lemon peel"
68,"Dry Vermouth, Gin, Kummel"
69,"Dark rum, Kahlua, Egg white"
70,"Amaretto, Dark Creme de Cacao, Coffee"
71,"Amaretto, Creme de Cacao, Light cream"
72,"Water, Ginger, Guava juice, Lemon juice, Pineapple, Sugar, Pineapple juice"
73,"Amaretto, Light cream"
74,"Sugar, Food coloring, Glycerine, Water, Apricot, Almond flavoring, Grain alcohol, Water, Brandy, Food coloring, Food coloring"
75,"Amaretto, Lime"
76,"Amaretto, Lime juice, Club soda"
77,"Chocolate ice-cream, Brandy, Amaretto"
78,"Amaretto, Sour mix"
79,"Amaretto, White Creme de Menthe"
80,"Amaretto, Sour mix, Orange juice"
81,"Sour mix, Amaretto, Tequila, Orange juice"
82,"Amaretto, Orange juice, Grenadine"
83,"Triple sec, Amaretto, Cider, Ice"
84,"Amaretto, Sweet and sour, Midori melon liqueur, Pineapple juice"
85,"Tea, Amaretto, Whipped cream"
86,"Campari, Sweet Vermouth, Lemon peel, Orange peel"
87,"Apricot brandy, Apple brandy, Gin"
88,"Angelica root, Water, Food coloring, Food coloring, Almond, Allspice, Cinnamon, Anise, Coriander, Marjoram leaves, Vodka, Sugar"
89,"Orange juice, Grapefruit juice, Apple juice, Maraschino cherry"
90,"Berries, Apple"
91,"Apple cider, Brown sugar, Lemonade, Orange juice, Cloves, Allspice, Nutmeg, Cinnamon"
92,"Tequila, Apple cider"
93,"Apple juice, Carrot"
94,"Apple juice, Malibu rum, Cinnamon"
95,"7-Up, Apple schnapps"
96,"Applejack, Triple sec, Lemon juice"
97,"Jack Daniels, Midori melon liqueur, Sour mix"
98,"Light rum, Apricot brandy, Triple sec, Lemon juice, Egg white, Orange"
99,"Apricot brandy, Champagne, Vodka, 7-Up, Orange juice"
100,"Gin, Wine, Benedictine, Lime"
101,"Vodka, Grape soda, Orange juice, Ice, Candy"
102,"Maui, Mountain Dew, Ice"
103,"Champagne, Green Creme de Menthe"
104,"Vodka, Midori melon liqueur, Sweet and sour"
105,"Absolut Vodka, Iced tea"
106,"Vodka, Malibu rum, Gold tequila, Orange juice, Pineapple juice, Cream of coconut, Grenadine, Ice, Pineapple"
107,"Vodka, Gin, Lime juice cordial, Ice"
108,"Gin, Grand Marnier, Lemon juice, Lemon peel"
109,"Sweet Vermouth, Gin, Bitters"
110,"Tea, Rye whiskey, Red wine, Rum, Brandy, Benedictine, Orange juice, Lemon juice"
111,"Vodka, Southern Comfort, Passion fruit syrup, Sweet and sour, Club soda"
112,"Lemonade, Vodka, Blue Curacao, Triple sec, Sugar, Ice"
113,"Jägermeister, Goldschlager"
114,"Vodka, Lime juice, Soda water"
115,"Crown Royal, Kahlua, Cream"
116,"Vodka, Pisang Ambon, Apple juice, Lemon juice, Lemonade"
117,"Gin, lemon juice, maraschino liqueur"
118,"Lemonade, Vodka, Rum, Ginger ale"
119,"Bailey's irish cream, Grand Marnier, Kahlua"
120,"Kahlua, Sambuca, Grand Marnier"
121,"Kahlua, Milk, Vanilla ice-cream"
122,"Kahlua, Bailey's irish cream"
123,"Light rum, Lime juice, Sugar syrup, Grenadine"
124,"Bailey's irish cream, Vanilla ice-cream, Cream"
125,"Scotch, Sweet Vermouth, Dry Vermouth, Bitters"
126,"Cantaloupe, Banana"
127,"Light rum, Triple sec, Banana, Lime juice, Sugar, Cherry"
128,"Milk, Orange juice, Sugar syrup, Banana"
129,"Strawberries, Banana, Yoghurt, Milk, Honey"
130,"Strawberries, Banana, Apple juice"
131,"Rum, Galliano, Pineapple Juice, Lime Juice, Prosecco"
132,"Vodka, Coconut liqueur, Blue Curacao, Sprite"
133,"Champagne, Peach schnapps"
134,"Ice, Vodka, Peach nectar, Peach schnapps, Lemon peel"
135,"Brandy, Gin, Dry Vermouth, Carbonated water, Lemon peel"
136,"Everclear, Wine, Orange juice, Kool-Aid"
137,"Brandy, Light rum, Triple sec, Lemon juice"
138,"Southern Comfort, Triple sec, Lime, Sour mix"
139,"Irish cream, Goldschlager"
140,"Ale, Guinness stout"
141,"Ice, Chocolate syrup, Cherry brandy, Vodka, Milk"
142,"Coffee liqueur, Vodka"
143,"Guinness stout, Root beer"
144,"Sweet Vermouth, Sloe gin, Lemon peel"
145,"Dark rum, Orange, Surge, Cranberry juice"
146,"Bailey's irish cream, Godiva liqueur, Kahlua, Butterscotch schnapps, Milk"
147,"Tequila, Tomato juice, Lemon juice, Tabasco sauce, Celery salt, Lemon"
148,"Vodka, Tomato juice, Lemon juice, Worcestershire sauce, Tabasco sauce, Lime"
149,"Vodka, Blue Curacao, Lemonade, Cherry"
150,"Tequila, Blue Curacao, Lime juice, Salt"
151,"Añejo rum, Tia maria, Vodka, Orange juice, Lemon juice"
152,"Gin, Triple sec, Blue Curacao, Bitters, Maraschino cherry, Lemon peel"
153,"Midori melon liqueur, Jägermeister, Goldschlager"
154,"Sweet Vermouth, Scotch, Benedictine, Lemon peel"
155,"Gin, Dry Vermouth, Bitters, Maraschino liqueur, Maraschino cherry"
156,"Vanilla Ice-Cream, Milk, Godiva liqueur, Whipped Cream, caramel sauce, chocolate sauce, Mini-snickers bars"
157,"Pineapple juice, Passion fruit juice, Lemon juice, Grenadine"
158,"Light rum, Brandy, Triple sec, Lime"
159,"Blended whiskey, Lemon, Powdered sugar, Egg white, Lemon, Cherry"
160,"Sugar, Water, Lemon juice, Bourbon, Lemon peel"
161,"Bourbon, Lemon juice, Sugar, Orange, Maraschino cherry"
162,"Gin, Triple sec, Lemon juice, Grenadine, Egg white"
163,"Everclear, Vodka, Mountain Dew, Surge, Lemon juice, Rum"
164,"Sambuca, Erin Cream, Advocaat"
165,"Gin, lemon juice, Sugar syrup, Creme de Mure"
166,"Vanilla ice-cream, Coca-Cola, Bourbon"
167,"Brandy, Creme de Cacao, Light cream, Nutmeg"
168,"Sugar, Club soda, Lemon, Brandy, Maraschino cherry, Orange"
169,"Brandy, Egg, Sugar, Light cream, Nutmeg"
170,"Brandy, Lemon, Powdered sugar, Lemon, Cherry"
171,"Tequila, Tabasco sauce"
172,"Grenadine, Kahlua, Bailey's irish cream"
173,"Vodka, Chambord raspberry liqueur, Peachtree schnapps, Cranberry juice"
174,"Vodka, Banana liqueur, Orange juice, Peach schnapps"
175,"Corona, Bacardi Limon"
176,"Bailey's irish cream, Kahlua, Sambuca"
177,"Vanilla Ice-Cream, Butterscotch schnapps, Milk, Vodka"
178,"Coffee, Milk, Triple sec, Brandy"
179,"Sugar, Lime, Cachaca"
180,"Lime, Sugar, White rum, Ice"
181,"Blended whiskey, Lemon, Lime, Powdered sugar, Grenadine, Carbonated water"
182,"Kahlua, Galliano, Soda water"
183,"Lager, Campari"
184,"Corona, Light rum"
185,"Orange, Vodka, Sugar"
186,"Gin, Maraschino liqueur, Lemon juice, Orange bitters, Cherry"
187,"Gin, Lemon juice, Maraschino liqueur, Orange bitters, Egg yolk"
188,"Cocoa powder, Sugar, Cornstarch, Water, Milk"
189,"Champagne, Sugar, Bitters, Lemon peel, Cognac"
190,"Gin, Tequila, Vodka, White rum, Triple Sec, Cherry Grenadine, Sweet and sour, Club soda"
191,"Light rum, Cherry brandy, Light cream"
192,"Light rum, Port, Lemon, Powdered sugar, Egg white, Carbonated water"
193,"Milk, Chocolate, Cinnamon, Egg"
194,"Kahlua, Vodka, Chocolate ice-cream"
195,"Chocolate, Milk, Water"
196,"Chocolate liqueur, Milk, Amaretto"
197,"Banana liqueur, Creme de Cacao, Chocolate ice-cream, Chocolate syrup, Chocolate milk, Whipped cream, Cherry, Banana"
198,"Bacardi Limon, Coca-Cola"
199,"Brandy, Triple sec, Lemon juice"
200,"Bitters, Water, Sugar, Bourbon, Orange, Maraschino cherry"
201,"Sweet Vermouth, Sloe gin, Wine"
202,"Gin, Grenadine, Lemon, Egg white"
203,"Coffee, Vanilla extract, Sugar, Vodka, Water"
204,"Water, Sugar, Coffee, Vanilla, Vodka, Caramel coloring"
205,"Coca-Cola, Lemon juice"
206,"Absolut Citron, Lime juice, Cointreau, Cranberry juice"
207,"Cointreau, Vodka, Lime, Cranberry juice"
208,"Cranberries, Sugar, Light rum"
209,"Cranberry juice, Sugar, Pineapple juice, Almond flavoring, Ginger ale"
210,"Spiced rum, Ginger ale"
211,"Sugar, Water, Grain alcohol, Peppermint extract, Food coloring"
212,"Dark rum, Lime, Coca-Cola, Ice"
213,"Light rum, Lime, Coca-Cola"
214,"Light rum, Lime, Powdered sugar"
215,"Whiskey, Hot Damn"
216,"Coffee, Everclear"
217,"demerara Sugar, Lime, Cachaca"
218,"Dark Rum, Ginger Beer"
219,"Cherry Heering, Soda water, Orange juice, Ice"
220,"gin, Peach Bitters, Mint"
221,"Lager, Cider, Blackcurrant cordial"
222,"Vodka, Dry Vermouth, Olive Brine, Lemon, Olive"
223,"Kahlua, Sambuca, Bailey's irish cream"
224,"Fruit punch, Sprite, Tequila, 151 proof rum"
225,"Gin, Ginger ale, Lime"
226,"Heavy cream, Milk, Cinnamon, Vanilla, Chocolate, Whipped cream"
227,"Scotch, Dry Vermouth, Lemon peel"
228,"Dubonnet Rouge, Gin, Bitters, Lemon peel"
229,"Pisco, Lime Juice, Pineapple Syrup, St. Germain, Angostura Bitters, Pepper, Lavender"
230,"Chocolate syrup, Milk, Soda water"
231,"Egg yolk, Sugar, Nutmeg, Sugar, Milk, Light rum, Bourbon, Vanilla extract, Salt, Whipping cream, Egg white"
232,"Egg, Sugar, Condensed milk, Milk, Vanilla extract, Rum, Nutmeg"
233,"Egg, Sugar, Salt, Milk, Vanilla extract"
234,"Brandy, Gin, Sweet Vermouth, Carbonated water, Lemon peel"
235,"Apricot brandy, Gin, Dry Vermouth, Grenadine, Lemon juice, Cherry"
236,"Vodka, Kahlua, Sugar syrup"
237,"Firewater, Absolut Peppar, Tabasco sauce"
238,"Amaretto, Vodka, 151 proof rum, Dr. Pepper, Beer"
239,"Kahlua, Sambuca, Blue Curacao, Bailey's irish cream"
240,"Sambuca, Sarsaparilla"
241,"Gin, Triple sec"
242,"Scotch, Sweet Vermouth, Bitters, Sugar syrup"
243,"Amaretto, Creme de Cacao, Light cream"
244,"Coffee, Milk, Sugar"
245,"Jägermeister, Sambuca, Vodka"
246,"Gin, Sugar, Lemon juice, Champagne, Orange, Maraschino cherry"
247,"Gin, Sugar, Lemon juice, Champagne, Orange, Maraschino cherry"
248,"Cognac, Amaretto"
249,"Vodka, Raspberry Liqueur, pineapple juice"
250,"Blended whiskey, Benedictine, Lemon, Lime, Lemon, Lime"
251,"Light rum, Triple sec, Lime juice, Sugar, Cherry, Ice"
252,"Light rum, Lime juice, Mint, Sugar"
253,"Light rum, Pineapple, Lime juice, Sugar"
254,"Apple juice, Strawberries, Sugar, Lemon, Apple, Soda water, Ice"
255,"Yoghurt, Fruit juice"
256,"Yoghurt, Banana, Orange juice, Fruit, Ice"
257,"Coffee, Peach schnapps"
258,"Galliano, Ginger ale, Ice"
259,"Peach Vodka, Lemon juice, Galliano, Sirup of roses"
260,"Gin, Brandy, Sweet Vermouth, Club soda"
261,"Dark rum, Vodka, Triple sec, Tequila, Melon liqueur, Mountain Dew"
262,"Gin, Tonic water, Lime"
263,"Gin, Carbonated water, Powdered sugar, Orange spiral, Lemon peel"
264,"Gin, Lemon juice, Sugar, Grenadine, Maraschino cherry, Orange"
265,"Gin, Lemon, Powdered sugar, Carbonated water"
266,"Gin, Grenadine, lemon, Soda Water, Lime"
267,"Gin, Lemon, Powdered sugar, Water, Orange peel"
268,"Gin, Carbonated water, Sugar, Mint, Orange, Cherry"
269,"Gin, Lemon juice, Sugar, Orange, Maraschino cherry"
270,"Gin, Grenadine, Powdered sugar, Pineapple, Strawberries, Carbonated water"
271,"Lime juice, Sugar, Gin, Bitters, Club soda"
272,"Gin, Water, Powdered sugar, Lemon peel"
273,"Cachaca, Lemon Juice, Agave Syrup, Champagne"
274,"Red wine, Water, Sugar, Cinnamon, Cloves, Lemon peel"
275,"Vodka, Amaretto, Heavy cream"
276,"Scotch, Amaretto"
277,"Vodka, Amaretto"
278,"Galliano, Triple Sec, orange juice, Cream"
279,"Malibu rum, Peach schnapps, Blue Curacao, Sweet and sour"
280,"Grapes, Lemon, Pineapple"
281,"Gin, Triple sec, Pineapple juice, Grenadine, Pineapple"
282,"Green Creme de Menthe, Creme de Cacao, Light cream"
283,"Cider, Lager, Blue Curacao"
284,"Kahlua, 151 proof rum, Grenadine"
285,"Amaretto, Jägermeister, Kahlua, Milk"
286,"Whisky, Bailey's irish cream, Coffee"
287,"Spiced rum, Ginger ale, Lime, Ice"
288,"Vodka, Galliano, Orange juice"
289,"Light rum, Pineapple juice, Lemon juice"
290,"Gin, Triple sec, Pineapple juice"
291,"Rum, Grapefruit Juice, Maraschino Liqueur, Lime Juice"
292,"Hot Damn, Tea"
293,"Scotch, Sweet Vermouth, Orange bitters, Olive"
294,"Grape juice, Carbonated soft drink, Sherbet, Sherbet"
295,"Sugar, Corn syrup, Coffee, Vanilla extract, Water, Vodka"
296,"Lemon peel, Brandy, Ginger ale, Bitters"
297,"Chocolate, Butter, Vanilla extract, Half-and-half, Marshmallows"
298,"Irish whiskey, Bailey's irish cream, Coffee"
299,"Vodka, Iced tea, Lemon juice"
300,"Coffee, Sugar, Water, Milk"
301,"Kahlua, Coffee"
302,"Lime juice, Gin, Aperol"
303,"Light rum, Blended whiskey, Lemon, Powdered sugar, Carbonated water"
304,"Lime, Brown sugar, Passion fruit juice, Ginger ale, Ice"
305,"Irish whiskey, Coffee, Sugar, Whipped cream"
306,"Scotch, Half-and-half, Condensed milk, Coconut syrup, Chocolate syrup"
307,"Bailey's irish cream, Bourbon, Vodka, Orange juice"
308,"Vodka, Kahlua, Coca-Cola, Guinness stout"
309,"Irish whiskey, Peach brandy, Orange juice, Sweet and sour, Orange, Cherry"
310,"Apple brandy, Grenadine, Lime"
311,"Ice, Tennessee whiskey, Vanilla extract, Coca-Cola"
312,"Jack Daniels, Amaretto"
313,"Baileys irish cream, Chambord raspberry liqueur, Sugar syrup, Sugar"
314,"Coffee liqueur, Light rum, Ice, Milk"
315,"Rum, Coffee, Water, Whipped cream"
316,"Blended whiskey, Lemon, Powdered sugar, Port, Egg white, Carbonated water"
317,"Vodka, Jello, Water"
318,"Blackberry brandy, Anis"
319,"Gin, Green Chartreuse, Yellow Chartreuse"
320,"Gin, Vodka, Grenadine, Lime juice, Sugar, Sugar syrup, Soda water"
321,"Bourbon, Lemon juice, Sugar, Club soda, Maraschino cherry, Orange"
322,"Milk, Chocolate syrup, Mint syrup"
323,"Vodka, Triple sec, Lime juice"
324,"Coffee, Grain alcohol"
325,"Bourbon, Benedictine"
326,"Bourbon, Benedictine, Lemon peel"
327,"Ginger, Lemon, Water"
328,"Kahlua, Brandy, Coffee"
329,"Creme de Cassis, Champagne"
330,"Creme de Cassis, Champagne"
331,"Cranberry vodka, Apfelkorn, Schweppes Russchian, Apple juice, Ice"
332,"Kiwi liqueur, Bitter lemon, Ice"
333,"Kiwi, Papaya"
334,"151 proof rum, Kool-Aid"
335,"Vodka, Amaretto, Sloe gin, Triple sec, Cranberry juice"
336,"Kool-Aid, Vodka"
337,"Absolut Kurant, Tea, Sugar"
338,"Gin, Light cream, Powdered sugar, Lemon, Egg white, Carbonated water"
339,"Yoghurt, Water, Cumin seed, Salt, Mint"
340,"Mango, Yoghurt, Sugar, Water"
341,"Yoghurt, Water, Sugar, Salt, Lemon juice"
342,"Yoghurt, Water, Salt, Asafoetida"
343,"Yoghurt, Ice, Sugar, Lime, Salt"
344,"Absolut Vodka, Cointreau, Lemon"
345,"Galliano, Absolut Citron, Lemon, Sugar, 151 proof rum"
346,"Ginger, Water, Lemon, Sugar, Cayenne pepper"
347,"Lime, Sugar, Soda water, Lime peel"
348,"Corona, Bacardi Limon"
349,"Scotch, Drambuie, Dry Vermouth, Lemon peel"
350,"Gin, Maraschino liqueur, Orange bitters"
351,"Sweet Vermouth, Gin"
352,"Carbonated water, Gin, Dry Vermouth, Powdered sugar, Orange spiral, Lemon peel"
353,"Vodka, Tequila, Light rum, Gin, Coca-Cola, Lemon peel"
354,"Vodka, Light rum, Gin, Tequila, Lemon, Coca-Cola"
355,"Vodka, Lime, Angostura bitters, Tonic water, Ice"
356,"Dark rum, Tia maria"
357,"Beer, Amaretto, Orange juice"
358,"Light rum, Orgeat syrup, Triple sec, Sweet and sour, Cherry"
359,"Malibu rum, Tropicana, Cranberry juice"
360,"Mango, Orange"
361,"Sweet Vermouth, Bourbon, Angostura bitters, Ice, Maraschino cherry, Orange peel"
362,"Tequila, Triple sec, Lime juice, Salt"
363,"Gin, Dry Vermouth, Triple sec, Orange bitters, Cherry"
364,"Gin, Dry Vermouth, Olive"
365,"Light rum, Pineapple juice, Maraschino liqueur, Grenadine, Maraschino cherry"
366,"Water, Tea, Ginger, Cardamom, Cloves, Cinnamon, Black pepper, Sugar, Milk"
367,"Espresso, Honey, Cocoa powder"
368,"151 proof rum, Pina colada mix, Daiquiri mix"
369,"Sugar, Cocoa powder, Salt, Water, Milk, Vanilla extract"
370,"Bourbon, Dark rum, Heavy cream"
371,"Kahlua, Bailey's irish cream, Goldschlager, Heavy cream, Coffee"
372,"Bailey's irish cream, White Creme de Menthe, Cream"
373,"Champagne, Orange juice"
374,"Brandy, Light rum, Bourbon, Lemon, Powdered sugar, Carbonated water"
375,"Coffee, Chambord raspberry liqueur, Cocoa powder, Whipped cream"
376,"Light rum, Lime, Sugar, Mint, Soda water"
377,"Mint, Lemon juice, Dark rum, Club soda, Angostura bitters"
378,"Gin, Benedictine, Orange juice, Grenadine"
379,"Light rum, Grapefruit juice, Bitters"
380,"Absinthe, Tequila, Grenadine"
381,"Vodka, Lime juice, Ginger ale"
382,"Goldschlager, Butterscotch schnapps, Milk"
383,"Southern Comfort, Orange juice, Pepsi Cola"
384,"Water, Sugar, Cloves, Cinnamon, Lemon peel, Red wine, Brandy"
385,"Rum, Vodka, Gin, Blue Curacao, Sour mix, Lemon-lime soda"
386,"Gin, Campari, Sweet Vermouth"
387,"Absolut Citron, Grand Marnier, Lemon juice, Club soda"
388,"Blended whiskey, Lemon, Sugar, Red wine, Lemon, Cherry"
389,"Cocoa powder, Sugar, Vanilla extract, Milk"
390,"Bailey's irish cream, Frangelico, Milk"
391,"Bourbon, Angostura bitters, Sugar, Water"
392,"Vodka, Triple sec, Orange juice"
393,"Cherry brandy, Gin, Orange juice, Ginger ale"
394,"Spiced rum, Grenadine, Orange juice, Sour mix"
395,"Milk, Chocolate, Orange peel, Espresso, Nutmeg"
396,"Orange juice, Rum, Vodka, Cream, Ice"
397,"Lemon juice, Orange juice, Sugar syrup, Soda water"
398,"Vodka, Kahlua, Bailey's irish cream, Vanilla ice-cream, Oreo cookie"
399,"Creme de Cacao, Amaretto, Triple sec, Vodka, Light cream"
400,"Whiskey, Beer, Lemonade, Ice"
401,"Gin, Apricot Brandy, Orange Juice"
402,"Light rum, Coconut milk, Pineapple"
403,"Ginger, Pineapple"
404,"Bitters, Gin"
405,"Gin, Grenadine, Light cream, Egg white"
406,"Sprite, Pink lemonade, Vodka"
407,"Everclear, Vodka, Peach schnapps, Orange juice, Cranberry juice"
408,"Pisco, Lemon juice, Sugar, Ice"
409,"Dark rum, Orgeat syrup, Orange juice, Pineapple juice"
410,"Vodka, Cherry liqueur, Cranberry juice, Orange juice"
411,"Gin, Creme de Cacao"
412,"Grenadine, Green Creme de Menthe"
413,"Port, Brandy"
414,"Port, Light cream, Powdered sugar, Egg, Nutmeg"
415,"Brandy, Port, Egg Yolk"
416,"Orange juice, Apple juice, Pineapple juice, Ice"
417,"Light rum, Brandy, Lemon, Raspberry syrup"
418,"Light rum, Sherry, Lime"
419,"Coffee brandy, Lime vodka, Sherry"
420,"Red wine, Grenadine, Lemon-lime soda"
421,"Dry Vermouth, Gin, Benedictine"
422,"Dark rum, Kahlua, Light cream, Nutmeg"
423,"Kahlua, Midori melon liqueur, Bailey's irish cream"
424,"Black Sambuca, Orange juice"
425,"Rum, Vodka, Tequila, Gin, Triple sec, Chambord raspberry liqueur, Midori melon liqueur, Malibu rum"
426,"Beer, 7-Up"
427,"Sugar syrup, Lemon juice, Ginger ale"
428,"Raspberry vodka, Lemon-lime soda, Ice"
429,"Crown Royal, Amaretto, Cranberry juice"
430,"Dry Vermouth, Gin, Apricot brandy, Lemon juice, Grenadine, Powdered sugar"
431,"Frangelico, Crown Royal"
432,"Gin, Sweet and sour, Egg, Coca-Cola"
433,"Crown Royal, Peach schnapps, Chambord raspberry liqueur, Cranberry juice"
434,"Gin, Lemon, Powdered sugar, Egg, Carbonated water"
435,"Gin, Cranberry juice, Grenadine"
436,"Sugar, Club soda, Lemon, Dark rum, Maraschino cherry, Orange"
437,"Rum, Lemon-lime soda, Lemon"
438,"Light rum, Milk, Powdered sugar, Nutmeg"
439,"Light rum, 151 proof rum, Powdered sugar, Bitters, Water, Lime peel"
440,"Rum, Ginger ale, Fruit punch, Orange juice, Ice"
441,"Malibu rum, Blackberry brandy, Orange juice, Pineapple juice, Cranberry juice"
442,"Light rum, Orange juice"
443,"Light rum, Lemon juice, Sugar, Orange, Maraschino cherry"
444,"Rum, Powdered sugar, Lemon peel, Water"
445,"Vodka, Creme de Cassis, Sugar Syrup, Lemon Juice"
446,"Scotch, Drambuie, Lemon peel"
447,"Grapefruit juice, Gin, Salt"
448,"Vodka, Creme de Banane, Grenadine, Orange juice"
449,"Red wine, Sugar, Orange juice, Lemon juice, Cloves, Cinnamon"
450,"Red wine, Sugar, Lemon, Orange, Apple, Brandy, Soda water"
451,"Ricard, Sugar, Peychaud bitters, Water, Bourbon, Lemon peel"
452,"Brandy, Amaretto, Light cream"
453,"Scotch, Brandy, Curacao, Orange, Mint"
454,"Scotch, Lime, Powdered sugar, Lemon, Cherry"
455,"Johnnie Walker, Honey, Angelica root, Fennel seeds, Lemon peel"
456,"Vodka, Bailey's irish cream, Kahlua"
457,"Vodka, Orange juice"
458,"Vodka, Cranberry juice, Grapefruit juice"
459,"Vodka, Peach schnapps, Cranberry juice, Grapefruit juice"
460,"Light rum, Anisette, Grenadine, Lemon"
461,"Lemonade, Water, Vodka"
462,"Sherry, Powdered sugar, Egg, Milk, Nutmeg"
463,"Sherry, Light cream, Powdered sugar, Egg, Nutmeg"
464,"Jim Beam, Jack Daniels, Wild Turkey"
465,"Cognac, Cointreau, Lemon juice"
466,"Brandy, Triple sec, Lemon"
467,"Cherry brandy, Grenadine, Gin, Sweet and sour, Carbonated water, Cherry"
468,"Sloe gin, Dry Vermouth, Orange bitters"
469,"Red wine, Peach schnapps, Pepsi Cola, Orange juice"
470,"Lager, Cider"
471,"Lager, Cider, Blackcurrant squash"
472,"Advocaat, Lemonade, Lemon, Ice"
473,"Brandy, Anisette"
474,"151 proof rum, Malibu rum, Pineapple juice, Orange juice, Grenadine, Cherries"
475,"Milk, Chocolate, Cinnamon, Egg yolk"
476,"Peach nectar, Orange juice, Brown sugar, Cinnamon, Cloves, Lime juice"
477,"Coffee, Cinnamon"
478,"Prosecco, Campari, Soda Water"
479,"Brandy, White Creme de Menthe"
480,"Apricot brandy, Orange juice, Sweet and sour"
481,"Strawberry schnapps, Light rum, Lime juice, Powdered sugar, Strawberries"
482,"Lemon, Sugar, Strawberries, Water"
483,"Strawberry schnapps, Tequila, Triple sec, Lemon juice, Strawberries, Salt"
484,"Strawberries, Honey, Water"
485,"Pineapple juice, Club soda, Orange juice, Lemon, Berries, Champagne"
486,"Ouzo, Bailey's irish cream, Gin, Grand Marnier"
487,"Coffee, Aquavit, Sugar"
488,"Milk, Banana, Honey"
489,"Red wine, Sugar, Water, Apple, Orange, Lime, Lemon, Fresca"
490,"Godiva liqueur, Milk"
491,"Grand Marnier, Coffee"
492,"Coffee, Jack Daniels, Amaretto, Whipped cream"
493,"Tequila, Lemon juice, Grenadine, Egg white, Ginger ale"
494,"Tequila, Lemon, Powdered sugar, Lemon, Cherry"
495,"Tequila, Orange juice, Grenadine"
496,"Tequila, Tabasco sauce"
497,"Yukon Jack, Cherry brandy, Southern Comfort, Sweet and sour"
498,"Kahlua, Irish cream, Amaretto, 151 proof rum, Cream"
499,"Coffee, Coriander, Cardamom, Sugar, Whipping cream, Ice"
500,"Coffee, Sugar, Cream, Cardamom"
501,"Tea, Water, Condensed milk, Ice, Mint"
502,"Creme de Cacao, Blue Curacao, Light rum"
503,"Scotch, Wine, Orange juice"
504,"Water, Brown sugar, Coffee, Rum, Vanilla extract"
505,"Gin, Lemon juice, Sugar, Club soda, Maraschino cherry, Orange"
506,"Tomato juice, Lemon juice, Celery salt"
507,"Tequila, Lime Juice, Agave syrup"
508,"Dry Vermouth, Gin, Anis, Bitters, Orange peel"
509,"Wild Turkey, Amaretto, Pineapple juice"
510,"Dry Vermouth, Gin, Maraschino liqueur, Anis, Orange bitters, Cherry"
511,"Apricot brandy, Orange juice, Orange bitters"
512,"Tequila, Tomato Juice, Orange Juice, Lime Juice, Sugar Syrup, Salt"
513,"Light rum, Maple syrup, Lemon juice"
514,"Dry Vermouth, Creme de Cassis, Carbonated water"
515,"Gin, Vodka, Lillet Blanc"
